FRANCISCA ISABEL CARDONA MAS;;52784027Q;665712642;JAMPOFFPLAY@GMAIL.COM;MORET, 8 - PUERTA 4;46003;VALENCIA;Valencia;84;129;;;;1;;;CONTRAREEMBOLSO. LLAMAR ANTES DE ENTREGAR.   CONTRAREMBOLSO
JUAN LOSTE RODRIGUEZ;;12028703W;915238199;;VALVERDE, 8 - 3º C;28004;MADRID;Madrid;60;85;;;;1;;;CONTRAREEMBOLSO. LLAMAR ANTES DE ENTREGAR. ENTREGAR POR LAS TARDES.   CONTRAREMBOLSO
MANUEL BARBERO RODRIGO;;07425680S;635770633;;SIERRA DE TORNABACAS, 11 - 2º C;28031;MADRID;Madrid;60;87;;;;1;;;CONTRAREEMBOLSO.LLAMAR ANTES DE ENTREGAR.ENTREGAR POR LAS MAÑANAS.    CONTRAREMBOLSO
MATI PURROY IRAIZOZ;;15748449G;609752405;;GOROABE, 24 - 4º IZQ;31005;PAMPLONA;Navarra;60;86;;;;1;;;CONTRAREEMBOLSO. LLAMAR ANTES DE ENTREGAR. ENTREGAR POR LAS MAÑANAS.   CONTRAREMBOLSO
NOELIA DORADO MARTIN;;3901154D;639238142;;SAN ANDRES, 20 - CASA;45470;LOS YEBENES;Toledo;88;133;;;;1;;;CONTRAREEMBOLSO. LLAMAR ANTES DE ENTREGAR.   CONTRAREMBOLSO
TERESA FACUNDEZ CONEJERO;;7425924Y;636413492;;DONANTES DE SANGRE, 8 - BJº G;10002;CACERES;Cáceres;74;109;;;;1;;;CONTRAREEMBOLSO-LLAMAR ANTES   CONTRAREMBOLSO
FRANCISCO QUILES TEODORO;;19459511Q;602459200;;PINTOR SALVADOR ABRIL, 9 - 1º-1;46005;VALENCIA;Valencia;84;129;;;;1;;;CONTRAREEMBOLSO-ENTREGAR POR LA TARDE-LLAMAR ANTES   CONTRAREMBOLSO