ARISTIDES MARTINEZ FIGUEREO;;12529778E;918514841;;RAFAEL ALBERTI, 16 - 3ºB;28400;COLLADO VILLALBA;Madrid;73;107;;;;1;;;CONTRAREEMBOLSO. LLAMAR ANTES DE ENTREGAR.   CONTRAREMBOLSO
JOAQUIN LOPEZ DE LABALA;;00114974C;635430280;;NORTE, 23 - 8ºA-2;30009;MURCIA;Murcia;60;85;;;;1;;;CONTRAREEMBOLSO-LLAMAR ANTES DE LA ENTREGA  NO ESTA EN EL DOMICILIO   CONTRAREMBOLSO
JULIA MARZO FARIÑAS;;14582767P;944167678;;BRUNO MAURICIO ZABALA, 26 - 4º PUERTA 4º;48003;BILBAO;Vizcaya;73;107;;;;1;;;CONTRAREEMBOLSO. LLAMAR ANTES DE ENTREGAR. ENTREGAR POR LAS TARDES.   CONTRAREMBOLSO
PILAR PRESA CATIVIELA;;17835573q;677411322;ppresacativiela@hotmail.com;alameda de osuna, 78 - 4ºB;28042;MADRID;Madrid;60;80;;;;1;;;CONTRAREEMBOLSO. LLAMAR ANTES DE ENTREGAR.   CONTRAREMBOLSO
REMEDIOS LOPEZ LOPEZ GALVEZ;;70342283A;637273482;;VERSALLES, 6 - 7ºA;28937;MOSTOLES;Madrid;74;109;;;;1;;;CONTRAREEMBOLSO. LLAMAR ANTES DE ENTREGAR.   CONTRAREMBOLSO
SOFIA BELLA GONZALEZ;;32565857L;915421874;;DE LA FLORIDA, 59 - 6º IZQ ESC A;28008;MADRID;Madrid;84;129;;;;1;;; CONTRAREEMBOLSO. LLAMAR ANTES DE ENTREGAR.   CONTRAREMBOLSO
VIRTUDES ESPALLARDO MENOR;;22409767Q;963710973;;GRAN CANARIA, 33 - PTA 17;46011;VALENCIA;Valencia;88;133;;;;1;;;CONTRAREEMBOLSO-ENTREGAR POR LA TARDE, DE 16:00 A 18:00H-LLAMAR ANTES PERO NO DE 10 A 12H   CONTRAREMBOLSO