ELIDIA BOIX FERRER;;40836005B;676135919;;IGLESIA, 3 - CASA;22569;BAILLS;Huesca;60;84;;;;1;;;CONTRAREEMBOLSO. LLAMAR ANTES DE ENTREGAR. ENTREGAR POR LAS MAÑANAS.   CONTRAREMBOLSO
FAUSTINA MARTIN MARTIN;;50020129M;918040592;;MIRRA, 32 - CASA;28760;TRES CANTOS;Madrid;60;86;;;;1;;;CONTRAREEMBOLSO. LLAMAR ANTES DE ENTREGAR. ENTREGAR POR LAS MAÑANAS.    CONTRAREMBOLSO
IRENE KOPPEL UGENAL;;41947523P;935840225;;BONAVISTA, 76 - 1º PLANTA;8198;SANT CUGAT DEL VALLES;Barcelona;60;82;;;;2;;;CONTRAREEMBOLSO. LLAMAR ANTES DE ENTREGAR. ENTREGAR POR LAS MAÑANAS.   CONTRAREMBOLSO
JUAN ENRIQUE BARANDALLA IMSA;;00648161K;942361821;JUANENRIQUE1952@HOTMAIL.COM;DAOIZ Y VELARDE, 5;39003;SANTANDER;Cantabria;60;85;;;;1;;;CONTRAREMBOLSO LLAMAR ANTES DE IR   CONTRAREMBOLSO
JUAN LUIS FERNANDEZ DIEZ;;35538595F;662031525;JLFDDELEON@HOTMAIL.COM;DE ZORRILLA, 162 - 1º IZQ;47006;VALLADOLID;Valladolid;60;80;;;;1;;;CONTRAREEMBOLSO. LLAMAR ANTES DE ENTREGAR.   CONTRAREMBOLSO
MARIA CONCEPCION SANCHEZ FRUTOS;;50672373S;699061636;CONCHIN47@HOTMAIL.COM;SAHAGUN, 2 - ESC IZQ 7º B;28925;ALCORCON;Madrid;60;86;;;;1;;;CONTRAREEMBOLSO. LLAMAR ANTES DE ENTREGAR.    CONTRAREMBOLSO
PEDRO GOMEZ CANO;;03611264B;925469211;;GRANDE, 17 - CASA;45720;CAMUÑAS;Toledo;60;84;;;;1;;;CONTRAREEMBOLSO. LLAMAR ANTES DE ENTREGAR. ENTREGAR POR LAS MAÑANAS.    CONTRAREMBOLSO
PHILIPS ROGERS ALEMANYS;;X0707945M;686720951;PHILIPSROGERSALEMANY@GMAIL.COM;NAPOLES, 215 - SOBRE ATICO 2ª;8013;BARCELONA;Barcelona;60;84;;;;1;;;CONTRAREEMBOLSO. LLAMAR ANTES DE ENTREGAR PORQUE NO HAY NADIE VIVIENDO EN EL DOMICILIO Y SE TIENE QUE DESPLAZAR PARA RECOGERLO   CONTRAREMBOLSO